2020_EICCL_63979_1,E.E.JSPR(RandB)-15/2021,Construction of fixed vision center under SUNETRA at,"Construction of fixed vision center under SUNETRA at CHC Erasama in the district of Jagatsinghpur for 20-21 (CIVIL,E.I and P.H.)",Works,Open Tender,Percentage,Civil Works - Buildings,No,No,NA ,23-Nov-2020 12:30 PM,NA ,180.0,No ,No,Online,05-Dec-2020 11:30 AM,EIC-CIVIL||SERNB-CIRCLE-CUTTACK||EERNB-DIVN-JAGATSINGPUR,Erasama,754139.0,1.0,,M/S. SABITA BEHERA,"759,018",Rejected-Finance,28-Apr-2021,EIC-CIVIL||SERNB-CIRCLE-CUTTACK||EERNB-DIVN-JAGATSINGPUR,"Construction of fixed vision center under SUNETRA at | Construction of fixed vision center under SUNETRA at CHC Erasama in the district of Jagatsinghpur for 20-21 (CIVIL,E.I and P.H.)","construction of fixed vision center under sunetra at | construction of fixed vision center under sunetra at chc erasama in the district of jagatsinghpur for 20-21 (civil,e.i and p.h.)",False,False,False,False,False,True,False,True,0.023096738895736556,False,True
2020_EICCL_63979_2,E.E.JSPR(RandB)-15/2021,Construction of fixed vision center under SUNETRA at,"Construction of fixed vision center under SUNETRA at CHC Kujanga in the district of Jagatsinghpur for 20-21 (CIVIL,E.I and P.H.)",Works,Open Tender,Percentage,Civil Works - Buildings,No,No,NA ,23-Nov-2020 12:30 PM,NA ,180.0,No ,No,Online,05-Dec-2020 11:30 AM,EIC-CIVIL||SERNB-CIRCLE-CUTTACK||EERNB-DIVN-JAGATSINGPUR,Kujanga,754141.0,1.0,,MINATI DAS,"759,018",Accepted-AOC,28-Apr-2021,EIC-CIVIL||SERNB-CIRCLE-CUTTACK||EERNB-DIVN-JAGATSINGPUR,"Construction of fixed vision center under SUNETRA at | Construction of fixed vision center under SUNETRA at CHC Kujanga in the district of Jagatsinghpur for 20-21 (CIVIL,E.I and P.H.)","construction of fixed vision center under sunetra at | construction of fixed vision center under sunetra at chc kujanga in the district of jagatsinghpur for 20-21 (civil,e.i and p.h.)",False,False,False,False,False,True,False,True,0.023096738895736556,False,True
2020_EICCL_63990_7,"S.E.K.C., Keonjhar No. 10 / 2020-21",Construction of OPD Building (GF) and Meeting Hall at Ekma CHC of Bargaon Block under OMBADC for the year 2019-20,Construction of OPD Building (GF) and Meeting Hall at Ekma CHC of Bargaon Block under OMBADC for the year 2019-20,Works,Open Tender,Percentage,Civil Works - Buildings,No,No,NA ,20-Nov-2020 09:00 AM,NA ,90.0,No ,No,Online,02-Dec-2020 12:00 PM,EIC-CIVIL||SERNB-CIRCLE-KEONJHAR,Sundargarh,770001.0,2.0,,RIZWAN RAZA,"10,545,108",Rejected-Finance,15-Apr-2021,EIC-CIVIL||SERNB-CIRCLE-KEONJHAR,Construction of OPD Building (GF) and Meeting Hall at Ekma CHC of Bargaon Block under OMBADC for the year 2019-20 | Construction of OPD Building (GF) and Meeting Hall at Ekma CHC of Bargaon Block under OMBADC for the year 2019-20,construction of opd building (gf) and meeting hall at ekma chc of bargaon block under ombadc for the year 2019-20 | construction of opd building (gf) and meeting hall at ekma chc of bargaon block under ombadc for the year 2019-20,False,False,False,False,False,True,False,True,0.03177332062448001,False,True
2020_EICCL_64131_1,S.E.J.C R AND B 13/2020-21,CONSTRUCTION OF CHC BUILDING AT SANOMASIGAM OF NABARANGPUR BLOCK OF NABARANGPUR DISTRICT FOR THE YEAR 2020-21,CIVIL WORKS,Works,National Competitive Bid,Percentage,Civil Works - Buildings,No,No,NA ,27-Nov-2020 10:00 AM,NA ,90.0,No ,No,Online,11-Dec-2020 10:00 AM,EIC-CIVIL||SERNB-CIRCLE-JEYPORE,NABARANGPUR,764059.0,2.0,,MS SANDHYA CONSTRUCTION,"46,553,655",Rejected-AOC,09-Apr-2021,EIC-CIVIL||SERNB-CIRCLE-JEYPORE,CONSTRUCTION OF CHC BUILDING AT SANOMASIGAM OF NABARANGPUR BLOCK OF NABARANGPUR DISTRICT FOR THE YEAR 2020-21 | CIVIL WORKS,construction of chc building at sanomasigam of nabarangpur block of nabarangpur district for the year 2020-21 | civil works,False,False,False,False,False,True,False,True,0.01690541422105182,False,True
2020_EICCL_64559_1,TCN NO 34 OF 2020-21,"Construction of DDC, Laboratory and Specialist IPDs 4 Nos for CHC Bangurigaon in the District of Puri for the year 2019-20","Construction of DDC, Laboratory and Specialist IPDs 4 Nos for CHC Bangurigaon in the District of Puri for the year 2019-20",Works,National Competitive Bid,Percentage,Civil Works - Buildings,No,No,NA ,11-Dec-2020 05:45 PM,NA ,90.0,No ,No,Online,18-Dec-2020 11:30 AM,EIC-CIVIL||SERNB-CIRCLE-KHURDA||EERNB-DIVN-PURI,Puri,752001.0,2.0,"50,35,352",BIMAN BEHERA,"4,280,553",Rejected-Technical,23-Apr-2021,EIC-CIVIL||SERNB-CIRCLE-KHURDA||EERNB-DIVN-PURI,"Construction of DDC, Laboratory and Specialist IPDs 4 Nos for CHC Bangurigaon in the District of Puri for the year 2019-20 | Construction of DDC, Laboratory and Specialist IPDs 4 Nos for CHC Bangurigaon in the District of Puri for the year 2019-20","construction of ddc, laboratory and specialist ipds 4 nos for chc bangurigaon in the district of puri for the year 2019-20 | construction of ddc, laboratory and specialist ipds 4 nos for chc bangurigaon in the district of puri for the year 2019-20",False,False,False,False,False,True,False,True,0.0567811127785337,False,True
2020_EICCL_64710_1,EE/R AND B/ SBP/ 14/2020-21,"Construction of Extension building of UPHC, Maneswar in Sambalpur for the year 2020-21 G 1",Building work,Works,National Competitive Bid,Percentage,Civil Works - Buildings,No,No,NA ,18-Dec-2020 04:00 PM,NA ,90.0,No ,No,Online,29-Dec-2020 11:30 AM,EIC-CIVIL||SERNB-CIRCLE-NORTHERN||EERNB-DIVN-SAMBALPUR,Sambalpur,768001.0,2.0,,ABHISHEK SINGH,"6,047,833",Accepted-AOC,06-Apr-2021,EIC-CIVIL||SERNB-CIRCLE-NORTHERN||EERNB-DIVN-SAMBALPUR,"Construction of Extension building of UPHC, Maneswar in Sambalpur for the year 2020-21 G 1 | Building work","construction of extension building of uphc, maneswar in sambalpur for the year 2020-21 g 1 | building work",False,False,False,False,False,True,False,True,0.01573794012105725,False,True
2020_EICCL_64848_2,SC RandB GM-II 20/2020-21,Construction of Labour Room at PHC N Gopalpur,Building work,Works,Open Tender,Percentage,Civil Works - Buildings,No,No,NA ,22-Dec-2020 11:00 AM,NA ,90.0,No ,No,Online,05-Jan-2021 11:30 AM,EIC-CIVIL||SERNB-CIRCLE-BERHAMPUR||EERNB-DIVN-GANJAM I,Gopalpur,760008.0,1.0,,SUMANT KUMAR BARIK,"1,123,305",Accepted-AOC,06-Apr-2021,EIC-CIVIL||SERNB-CIRCLE-BERHAMPUR||EERNB-DIVN-GANJAM I,Construction of Labour Room at PHC N Gopalpur | Building work,construction of labour room at phc n gopalpur | building work,False,False,False,False,False,True,False,True,0.009256689480024213,False,True
2020_ORULB_59275_9,EO/JMC/ 045/2020-21,Construction of community hall near khanduall mandir ward no-22 under UNNATI for 2017-18,Construction of community hall near khanduall mandir ward no-22 under UNNATI for 2017-18,Works,Open Tender,Percentage,Civil Works - Others,No,No,NA ,29-Jan-2020 10:00 AM,NA ,60.0,No ,No,Online,13-Feb-2020 11:30 AM,Municipal Bodies||Jatni Municipal Council,"EXECUTIVE OFFICER,JATNI MUNICIPALITY",752050.0,1.0,"1,78,471",SANTOSH KUMAR SAMANTRAY,"174,901",Rejected-Technical,05-Apr-2021,Municipal Bodies||Jatni Municipal Council,Construction of community hall near khanduall mandir ward no-22 under UNNATI for 2017-18 | Construction of community hall near khanduall mandir ward no-22 under UNNATI for 2017-18,construction of community hall near khanduall mandir ward no-22 under unnati for 2017-18 | construction of community hall near khanduall mandir ward no-22 under unnati for 2017-18,False,False,False,False,True,False,False,True,0.011540796420996629,False,True
2020_ORULB_60683_26,EO/JMC/ 048/2019-20,Renovation of Jubashree Community Hall in ward no-19 under UNNATI for 2017-18,Renovation of Jubashree Community Hall in ward no-19 under UNNATI for 2017-18,Works,Open Tender,Percentage,Civil Works - Others,No,No,NA ,19-Mar-2020 10:00 AM,NA ,60.0,No ,No,Online,30-May-2020 11:30 AM,Municipal Bodies||Jatni Municipal Council,"EXECUTIVE OFFICER,JATNI MUNICIPALITY",752050.0,1.0,"2,67,602",Surendra Behera,"267,601",Rejected-Technical,06-Apr-2021,Municipal Bodies||Jatni Municipal Council,Renovation of Jubashree Community Hall in ward no-19 under UNNATI for 2017-18 | Renovation of Jubashree Community Hall in ward no-19 under UNNATI for 2017-18,renovation of jubashree community hall in ward no-19 under unnati for 2017-18 | renovation of jubashree community hall in ward no-19 under unnati for 2017-18,False,False,False,False,True,False,False,True,0.007837877016610937,False,True
2020_ORULB_63790_14,GUN-MUN-48/2020-21,Construction of rest shed at Bye-Pass Junction Gunupur near Hotel Pakwan under Municipality Gunupur,Construction of rest shed at Bye-Pass Junction Gunupur near Hotel Pakwan under Municipality Gunupur,Works,Open Tender,Percentage,Civil Works - Roads,No,No,NA ,17-Nov-2020 10:00 AM,NA ,120.0,No ,No,Online,02-Dec-2020 11:00 AM,Municipal Bodies||Gunupur Municipal Council,GUNUPUR,765022.0,1.0,,BALIA MOHANTY,"590,320",Rejected-AOC,13-Apr-2021,Municipal Bodies||Gunupur Municipal Council,Construction of rest shed at Bye-Pass Junction Gunupur near Hotel Pakwan under Municipality Gunupur | Construction of rest shed at Bye-Pass Junction Gunupur near Hotel Pakwan under Municipality Gunupur,construction of rest shed at bye-pass junction gunupur near hotel pakwan under municipality gunupur | construction of rest shed at bye-pass junction gunupur near hotel pakwan under municipality gunupur,False,False,False,False,True,False,False,True,0.007113812842575418,False,True
2020_ORULB_63790_9,GUN-MUN-48/2020-21,Repair of road in Laxman Dhepa near Community Hall Ward No2 Gunupur Municipality,Repair of road in Laxman Dhepa near Community Hall Ward No2 Gunupur Municipality,Works,Open Tender,Percentage,Civil Works - Others,No,No,NA ,17-Nov-2020 10:00 AM,NA ,120.0,No ,No,Online,02-Dec-2020 11:00 AM,Municipal Bodies||Gunupur Municipal Council,GUNUPUR,765022.0,1.0,,PURNA CHANDRA BAURI,"14,989",Rejected-AOC,04-Apr-2021,Municipal Bodies||Gunupur Municipal Council,Repair of road in Laxman Dhepa near Community Hall Ward No2 Gunupur Municipality | Repair of road in Laxman Dhepa near Community Hall Ward No2 Gunupur Municipality,repair of road in laxman dhepa near community hall ward no2 gunupur municipality | repair of road in laxman dhepa near community hall ward no2 gunupur municipality,False,False,False,False,True,False,False,True,0.003574388057839183,False,True
2020_ORULB_64193_6,10/VNM/2020-21,"Special repair and renovation of sulabhasouchalaya, bath complex at area Hospital, Jajpur Road,","Special repair and renovation of sulabhasouchalaya, bath complex at area Hospital, Jajpur Road,",Works,Open Tender,Percentage,Civil Works - Others,No,No,NA ,27-Nov-2020 03:00 PM,NA ,90.0,No ,No,Online,08-Dec-2020 11:00 AM,Municipal Bodies||Vyasanagar Municipality,Jajpur,755001.0,1.0,,ASHOK KUMAR JENA,"329,248.77",Accepted-AOC,13-Apr-2021,Municipal Bodies||Vyasanagar Municipality,"Special repair and renovation of sulabhasouchalaya, bath complex at area Hospital, Jajpur Road, | Special repair and renovation of sulabhasouchalaya, bath complex at area Hospital, Jajpur Road,","special repair and renovation of sulabhasouchalaya, bath complex at area hospital, jajpur road, | special repair and renovation of sulabhasouchalaya, bath complex at area hospital, jajpur road,",False,False,False,False,False,True,False,True,0.03320072676660562,False,True
2020_ORULB_64512_17,MC(CMC)CTC_Div-I_No44/2020-21,Raising to road infront of Beleswar AWC Building and repair to road from Gobinda Behera res to Prakash Mohapatra res in Ward No. 32 (ii) Repair to road at Tareni lane Bajrakabati road near B.C. Das res front and Dr. A. K. Baliarsingh Clinic in Ward N,Raising to road infront of Beleswar AWC Building and repair to road from Gobinda Behera res to Prakash Mohapatra res in Ward No. 32 (ii) Repair to road at Tareni lane Bajrakabati road near B.C. Das res front and Dr. A. K. Baliarsingh Clinic in Ward N,Works,Open Tender,Percentage,Civil Works - Others,No,No,NA ,14-Dec-2020 06:30 PM,NA ,90.0,No ,No,Online,30-Dec-2020 11:00 AM,Municipal Bodies||Cuttack Municipal Corporation,CMC,753012.0,1.0,,HRUSHIKESH SAHOO,"299,667",Accepted-AOC,20-Apr-2021,Municipal Bodies||Cuttack Municipal Corporation,Raising to road infront of Beleswar AWC Building and repair to road from Gobinda Behera res to Prakash Mohapatra res in Ward No. 32 (ii) Repair to road at Tareni lane Bajrakabati road near B.C. Das res front and Dr. A. K. Baliarsingh Clinic in Ward N | Raising to road infront of Beleswar AWC Building and repair to road from Gobinda Behera res to Prakash Mohapatra res in Ward No. 32 (ii) Repair to road at Tareni lane Bajrakabati road near B.C. Das res front and Dr. A. K. Baliarsingh Clinic in Ward N,raising to road infront of beleswar awc building and repair to road from gobinda behera res to prakash mohapatra res in ward no. 32 (ii) repair to road at tareni lane bajrakabati road near b.c. das res front and dr. a. k. baliarsingh clinic in ward n | raising to road infront of beleswar awc building and repair to road from gobinda behera res to prakash mohapatra res in ward no. 32 (ii) repair to road at tareni lane bajrakabati road near b.c. das res front and dr. a. k. baliarsingh clinic in ward n,False,False,False,False,False,True,False,True,0.04513678991541617,False,True
2020_ORULB_64513_12,MC(CMC)CTC_Div-I_No45/2020-21,Construction of Toilet-cum Watchman shed at Community Hall Gorakabar in Ward No.16.,Construction of Toilet-cum Watchman shed at Community Hall Gorakabar in Ward No.16.,Works,Open Tender,Percentage,Civil Works - Others,No,No,NA ,31-Dec-2020 03:00 PM,NA ,90.0,No ,No,Online,16-Jan-2021 11:00 AM,Municipal Bodies||Cuttack Municipal Corporation,CMC,753012.0,1.0,,PITAMBER MALIK,"292,741",Accepted-AOC,09-Apr-2021,Municipal Bodies||Cuttack Municipal Corporation,Construction of Toilet-cum Watchman shed at Community Hall Gorakabar in Ward No.16. | Construction of Toilet-cum Watchman shed at Community Hall Gorakabar in Ward No.16.,construction of toilet-cum watchman shed at community hall gorakabar in ward no.16. | construction of toilet-cum watchman shed at community hall gorakabar in ward no.16.,False,False,False,False,True,False,False,True,0.008585288038415873,False,True
2020_RMC_64511_36,MC/RMC/18/2020,Renovation of drain from qtr no. WWW 1 to C4 15 back side of KTH Hospital Ward No. 4 Civil Township,Works,Works,Open Tender,Percentage,Civil Works - Others,No,No,NA ,10-Dec-2020 06:55 PM,NA ,90.0,No ,No,Online,23-Dec-2020 11:00 AM,Rourkela Municipal Corporation,Rourkela,769012.0,1.0,,MANORANJAN JENA,"836,022.79",Rejected-Technical,05-Apr-2021,Rourkela Municipal Corporation,Renovation of drain from qtr no. WWW 1 to C4 15 back side of KTH Hospital Ward No. 4 Civil Township | Works,renovation of drain from qtr no. www 1 to c4 15 back side of kth hospital ward no. 4 civil township | works,False,False,False,False,False,True,False,True,0.013476295457529448,False,True
2020_RWSS_62589_1,RWSS(SBP)-07/20-21,Construction of pump house boundary wall RCC ESR valve chamber stand post and distribution system etc With supplying of all materials including pipes valves and fittings for RPWS to village Govindpali and Satijore under Dhankauda Block,Construction of pump house boundary wall RCC ESR valve chamber stand post and distribution system etc With supplying of all materials including pipes valves and fittings for RPWS to village Govindpali and Satijore under Dhankauda Block,Works,Open Tender,Turn-key,Civil Works - Water Works,No,No,NA ,09-Sep-2020 09:00 AM,NA ,90.0,No ,No,Online,19-Sep-2020 11:30 AM,Rural Water Supply and Sanitation||RWSS Circle Sambalpur||RWSS Division Sambalpur,DHANKAUDA,768006.0,2.0,"84,81,176",RYTHAM AGRAWAL,"7,209,848",Rejected-Finance,16-Apr-2021,Rural Water Supply and Sanitation||RWSS Circle Sambalpur||RWSS Division Sambalpur,Construction of pump house boundary wall RCC ESR valve chamber stand post and distribution system etc With supplying of all materials including pipes valves and fittings for RPWS to village Govindpali and Satijore under Dhankauda Block | Construction of pump house boundary wall RCC ESR valve chamber stand post and distribution system etc With supplying of all materials including pipes valves and fittings for RPWS to village Govindpali and Satijore under Dhankauda Block,construction of pump house boundary wall rcc esr valve chamber stand post and distribution system etc with supplying of all materials including pipes valves and fittings for rpws to village govindpali and satijore under dhankauda block | construction of pump house boundary wall rcc esr valve chamber stand post and distribution system etc with supplying of all materials including pipes valves and fittings for rpws to village govindpali and satijore under dhankauda block,False,True,False,False,False,False,False,True,0.08993027184029695,False,True
2020_RWSS_63791_8,EERWSSBAM- 13 ( A ) / 2020-21,"PWS to Krushnapur , Liakhai under Chikiti Block","Laying of pipelines, Construction of valve Chambers, stand post,Construction of 100 KL ltrs capacity RCC ESR,providing 100 percent FHTC etc.in connection with to PWS to Krushnapur , Liakhai under Chikiti Block",Works,National Competitive Bid,Item Rate,Civil Works - Water Works,No,No,NA ,16-Nov-2020 09:00 AM,NA ,180.0,No ,No,Online,27-Nov-2020 11:00 AM,Rural Water Supply and Sanitation||RWSS Circle Berhampur||RWSS Division Berhampur,"PWS to Krushnapur , Liakhai under Chikiti Block",760004.0,2.0,"65,44,000",RAGHUNATH CHAUDHURI,"7,165,068",Rejected-AOC,11-Apr-2021,Rural Water Supply and Sanitation||RWSS Circle Berhampur||RWSS Division Berhampur,"PWS to Krushnapur , Liakhai under Chikiti Block | Laying of pipelines, Construction of valve Chambers, stand post,Construction of 100 KL ltrs capacity RCC ESR,providing 100 percent FHTC etc.in connection with to PWS to Krushnapur , Liakhai under Chikiti Block","pws to krushnapur , liakhai under chikiti block | laying of pipelines, construction of valve chambers, stand post,construction of 100 kl ltrs capacity rcc esr,providing 100 percent fhtc etc.in connection with to pws to krushnapur , liakhai under chikiti block",False,True,False,False,False,False,False,True,0.019615520545280686,False,True
2020_RWSS_64007_2,EE/RWSS/GPT/19/2020-21,"(1) LAYING OF PIPE LINES, CONSTN. OF VALVE CHAMBERS, STAND POSTS, PUMP HOUSE(6.25x3.75) , 30000 LTRS CAPACITY OGR AND PROVIDING FHTC IN CONNECTION WITH PWS TO village LUHANGAR,(2) BAGARI IN LUHANGAR GP UNDER NUAGADA BLOCK","(1) LAYING OF PIPE LINES, CONSTN. OF VALVE CHAMBERS, STAND POSTS, PUMP HOUSE(6.25x3.75) , 30000 LTRS CAPACITY OGR AND PROVIDING FHTC IN CONNECTION WITH PWS TO village LUHANGAR,(2) BAGARI IN LUHANGAR GP UNDER NUAGADA BLOCK",Works,National Competitive Bid,Percentage,Civil Works - Water Works,No,No,NA ,20-Nov-2020 05:00 PM,20-Nov-2020 05:00 PM ,240.0,No ,No,Online,02-Dec-2020 11:00 AM,Rural Water Supply and Sanitation||RWSS Circle Berhampur||RWSS Division Gajapati,EE RWSS GAJAPATI,761201.0,2.0,"66,00,000",Pradeepta Kumar Panigrahy,"5,874,831.47",Rejected-Finance,09-Apr-2021,Rural Water Supply and Sanitation||RWSS Circle Berhampur||RWSS Division Gajapati,"(1) LAYING OF PIPE LINES, CONSTN. OF VALVE CHAMBERS, STAND POSTS, PUMP HOUSE(6.25x3.75) , 30000 LTRS CAPACITY OGR AND PROVIDING FHTC IN CONNECTION WITH PWS TO village LUHANGAR,(2) BAGARI IN LUHANGAR GP UNDER NUAGADA BLOCK | (1) LAYING OF PIPE LINES, CONSTN. OF VALVE CHAMBERS, STAND POSTS, PUMP HOUSE(6.25x3.75) , 30000 LTRS CAPACITY OGR AND PROVIDING FHTC IN CONNECTION WITH PWS TO village LUHANGAR,(2) BAGARI IN LUHANGAR GP UNDER NUAGADA BLOCK","(1) laying of pipe lines, constn. of valve chambers, stand posts, pump house(6.25x3.75) , 30000 ltrs capacity ogr and providing fhtc in connection with pws to village luhangar,(2) bagari in luhangar gp under nuagada block | (1) laying of pipe lines, constn. of valve chambers, stand posts, pump house(6.25x3.75) , 30000 ltrs capacity ogr and providing fhtc in connection with pws to village luhangar,(2) bagari in luhangar gp under nuagada block",False,True,False,False,False,False,False,True,0.025267218186531524,False,True
2020_RWSS_64601_5,EERWSSBAM- 16 ( A ) / 2020-21,PWS to Usta Jagannathapur under Sanakhemundi Block,"Laying of pipelines, Construction of valve Chambers, stand post,Construction of 50 KL ltrs capacity RCC ESR,providing 100 percent FHTC With 5 years O and M etc.in connection with to PWS to Usta Jagannathapur under Sanakhemundi Block",Works,National Competitive Bid,Item Rate,Civil Works - Water Works,No,No,NA ,14-Dec-2020 11:00 AM,NA ,180.0,No ,No,Online,29-Dec-2020 11:00 AM,Rural Water Supply and Sanitation||RWSS Circle Berhampur||RWSS Division Berhampur,PWS to Usta Jagannathapur under Sanakhemundi,760004.0,2.0,,Rajani Kanta Panigrahy,"5,623,016",Rejected-AOC,24-Apr-2021,Rural Water Supply and Sanitation||RWSS Circle Berhampur||RWSS Division Berhampur,"PWS to Usta Jagannathapur under Sanakhemundi Block | Laying of pipelines, Construction of valve Chambers, stand post,Construction of 50 KL ltrs capacity RCC ESR,providing 100 percent FHTC With 5 years O and M etc.in connection with to PWS to Usta Jagannathapur under Sanakhemundi Block","pws to usta jagannathapur under sanakhemundi block | laying of pipelines, construction of valve chambers, stand post,construction of 50 kl ltrs capacity rcc esr,providing 100 percent fhtc with 5 years o and m etc.in connection with to pws to usta jagannathapur under sanakhemundi block",False,True,False,False,False,False,False,True,0.031152349739298438,False,True
2020_RWSS_64601_6,EERWSSBAM- 16 ( A ) / 2020-21,PWS to Gunasagar and Hansarali under Sanakhemundi Block,"Laying of pipelines, Construction of valve Chambers, stand post,Construction of 75 KL ltrs capacity RCC ESR,providing 100 percent FHTC With 5 years O and M etc.in connection with to PWS to Gunasagar and Hansarali under Sanakhemundi Block",Works,National Competitive Bid,Item Rate,Civil Works - Water Works,No,No,NA ,14-Dec-2020 11:00 AM,NA ,180.0,No ,No,Online,29-Dec-2020 11:00 AM,Rural Water Supply and Sanitation||RWSS Circle Berhampur||RWSS Division Berhampur,PWS to Gunasagar and Hansarali under Sanakhemundi,760004.0,2.0,,BHAGABAN PANIGRAHI,"7,539,669",Accepted-AOC,12-Apr-2021,Rural Water Supply and Sanitation||RWSS Circle Berhampur||RWSS Division Berhampur,"PWS to Gunasagar and Hansarali under Sanakhemundi Block | Laying of pipelines, Construction of valve Chambers, stand post,Construction of 75 KL ltrs capacity RCC ESR,providing 100 percent FHTC With 5 years O and M etc.in connection with to PWS to Gunasagar and Hansarali under Sanakhemundi Block","pws to gunasagar and hansarali under sanakhemundi block | laying of pipelines, construction of valve chambers, stand post,construction of 75 kl ltrs capacity rcc esr,providing 100 percent fhtc with 5 years o and m etc.in connection with to pws to gunasagar and hansarali under sanakhemundi block",False,True,False,False,False,False,False,True,0.05674020658738091,False,True
2020_RWSS_64948_12,BID No 21 of 2020 - 21,Laying of rising main distribution system single mouth stand post SVAVNRV chamber including supplying of necessary materials for RPWS to village Ichhapada under Muribahal Block.,Laying of rising main distribution system single mouth stand post SVAVNRV chamber including supplying of necessary materials for RPWS to village Ichhapada under Muribahal Block.,Works,National Competitive Bid,Percentage,Civil Works - Water Works,No,No,NA ,25-Dec-2020 03:00 PM,NA ,180.0,No ,No,Online,15-Jan-2021 11:00 AM,Rural Water Supply and Sanitation||RWSS Circle Bolangir||RWSS Division Bolangir,Ichhapada under Muribahal Block,767037.0,1.0,,chhabalilal panika,"2,712,582",Rejected-AOC,15-Apr-2021,Rural Water Supply and Sanitation||RWSS Circle Bolangir||RWSS Division Bolangir,Laying of rising main distribution system single mouth stand post SVAVNRV chamber including supplying of necessary materials for RPWS to village Ichhapada under Muribahal Block. | Laying of rising main distribution system single mouth stand post SVAVNRV chamber including supplying of necessary materials for RPWS to village Ichhapada under Muribahal Block.,laying of rising main distribution system single mouth stand post svavnrv chamber including supplying of necessary materials for rpws to village ichhapada under muribahal block. | laying of rising main distribution system single mouth stand post svavnrv chamber including supplying of necessary materials for rpws to village ichhapada under muribahal block.,False,True,False,False,False,False,False,True,0.04504822305214378,False,True
2020_STSCD_63640_35,ITDABPD-01/2020-21,Floor Improvement and New Painting with Sinking of One Tube Well with Water Supply System for ISO to 100 Seated STGH of Manida SSD High School under Rasgobindpur Block,Floor Improvement and New Painting with Sinking of One Tube Well with Water Supply System for ISO to 100 Seated STGH of Manida SSD High School under Rasgobindpur Block,Works,National Competitive Bid,Percentage,Civil Works - Others,No,No,NA ,09-Nov-2020 10:00 AM,NA ,90.0,No ,No,Online,26-Nov-2020 11:00 AM,ST and SC Development Deptt||ITDA Baripada,BARIPADA,757002.0,1.0,,SUDEEP KUMAR GIRI,"679,604.904",Rejected-Technical,07-Apr-2021,ST and SC Development Deptt||ITDA Baripada,Floor Improvement and New Painting with Sinking of One Tube Well with Water Supply System for ISO to 100 Seated STGH of Manida SSD High School under Rasgobindpur Block | Floor Improvement and New Painting with Sinking of One Tube Well with Water Supply System for ISO to 100 Seated STGH of Manida SSD High School under Rasgobindpur Block,floor improvement and new painting with sinking of one tube well with water supply system for iso to 100 seated stgh of manida ssd high school under rasgobindpur block | floor improvement and new painting with sinking of one tube well with water supply system for iso to 100 seated stgh of manida ssd high school under rasgobindpur block,False,True,False,False,False,False,False,True,0.05956461913923545,False,True
