2021_EICCL_68234_1,eTCN-04 of 2021-22,Extension of UPHC IRC Village Bhubaneswar for the year 2021-22,Extension of UPHC IRC Village Bhubaneswar for the year 2021-22,Works,Open Tender,Percentage,Civil Works - Buildings,No,No,NA ,07-May-2021 09:00 AM,NA ,90.0,No ,No,Online,23-Jun-2021 11:00 AM,EIC-CIVIL||SERNB-CIRCLE-CENTRAL||EERNB-DIVN-III-BBSR,Bhubaneswar,751001.0,2.0,,AKSHAYA KUMAR SAHOO,"5,235,511",Accepted-AOC,27-Sep-2021,EIC-CIVIL||SERNB-CIRCLE-CENTRAL||EERNB-DIVN-III-BBSR,Extension of UPHC IRC Village Bhubaneswar for the year 2021-22 | Extension of UPHC IRC Village Bhubaneswar for the year 2021-22,extension of uphc irc village bhubaneswar for the year 2021-22 | extension of uphc irc village bhubaneswar for the year 2021-22,False,False,False,False,False,True,False,True,0.01105834534292833,False,True
2021_EICCL_69159_2,01/KBJ/2021-22(1),"Construction of Kitchen with Store Room and Dining area for CHC, Belpada in the district of Balangir","Construction of Kitchen with Store Room and Dining area for CHC, Belpada in the district of Balangir",Works,National Competitive Bid,Percentage,Civil Works - Buildings,No,No,NA ,18-Jun-2021 11:00 AM,NA ,90.0,No ,No,Online,29-Jun-2021 11:30 AM,EIC-CIVIL||SERNB-CIRCLE-BOLANGIR||EERNB-DIVISION-KANTABANJI,KANTABANJI,767039.0,1.0,,ANITA AGRAWAL,"1,508,119",Rejected-AOC,04-Sep-2021,EIC-CIVIL||SERNB-CIRCLE-BOLANGIR||EERNB-DIVISION-KANTABANJI,"Construction of Kitchen with Store Room and Dining area for CHC, Belpada in the district of Balangir | Construction of Kitchen with Store Room and Dining area for CHC, Belpada in the district of Balangir","construction of kitchen with store room and dining area for chc, belpada in the district of balangir | construction of kitchen with store room and dining area for chc, belpada in the district of balangir",False,False,False,False,False,True,False,True,0.042795702615631905,False,True
2021_EICCL_69543_2,Bid Identification No-EE-RandB-SNG-04 OF 2021-22,"Construction of Boundary Wall around new Urban PHC at Luhuradhipa, Sundargarh 2021-22 (Under DMF)","Construction of Boundary Wall around new Urban PHC at Luhuradhipa, Sundargarh 2021-22 (Under DMF)",Works,Open Tender,Percentage,Civil Works - Buildings,No,No,NA ,05-Jul-2021 10:00 AM,NA ,90.0,No ,No,Online,16-Jul-2021 11:00 AM,EIC-CIVIL||SERNB-CIRCLE-KEONJHAR||EERNB-DIVN-SUNDERGARH,Sundargarh,770001.0,1.0,,SMRUTI RANJAN PATTNAIK,"1,491,425.23",Rejected-AOC,05-Sep-2021,EIC-CIVIL||SERNB-CIRCLE-KEONJHAR||EERNB-DIVN-SUNDERGARH,"Construction of Boundary Wall around new Urban PHC at Luhuradhipa, Sundargarh 2021-22 (Under DMF) | Construction of Boundary Wall around new Urban PHC at Luhuradhipa, Sundargarh 2021-22 (Under DMF)","construction of boundary wall around new urban phc at luhuradhipa, sundargarh 2021-22 (under dmf) | construction of boundary wall around new urban phc at luhuradhipa, sundargarh 2021-22 (under dmf)",False,False,False,False,False,True,False,True,0.08896670655619926,False,True
2021_OHPCL_66932_1,EEPDD-04/2020-21,"R/M to 32 Bedded UIP, Hospital, Khatiguda",Civil work,Works,Open Tender,Percentage,Civil Works - Buildings,No,No,NA ,06-Mar-2021 11:00 AM,NA ,90.0,No ,No,Online,17-Mar-2021 11:00 AM,Odisha Hydro Power Corporation Ltd||Upper Indravati H.E. Project Khatiguda||EE Muran Dam Division,KHATIGUDA,764085.0,1.0,,SAMIR KUMAR BHANJASAMANTA,"896,636",Rejected-AOC,23-Sep-2021,Odisha Hydro Power Corporation Ltd||Upper Indravati H.E. Project Khatiguda||EE Muran Dam Division,"R/M to 32 Bedded UIP, Hospital, Khatiguda | Civil work","r/m to 32 bedded uip, hospital, khatiguda | civil work",False,False,False,False,False,True,False,True,0.011023697552673874,False,True
2021_OHPCL_66944_1,EEPDD-04/2020-21,Annual maintenance to the whole garden and road side plantation at down stream of Indravati Dam for one year ( 12 Calaender,Civil work,Works,Open Tender,Item Rate,Civil Works - Others,No,No,NA ,06-Mar-2021 11:00 AM,NA ,90.0,No ,No,Online,17-Mar-2021 11:00 AM,Odisha Hydro Power Corporation Ltd||Upper Indravati H.E. Project Khatiguda||EE Muran Dam Division,KHATIGUDA,764085.0,1.0,,KAILASH HARIJAN,"559,696",Rejected-Finance,21-Sep-2021,Odisha Hydro Power Corporation Ltd||Upper Indravati H.E. Project Khatiguda||EE Muran Dam Division,Annual maintenance to the whole garden and road side plantation at down stream of Indravati Dam for one year ( 12 Calaender | Civil work,annual maintenance to the whole garden and road side plantation at down stream of indravati dam for one year ( 12 calaender | civil work,False,False,True,False,False,False,False,True,0.07900010323075209,False,True
2021_ORULB_67085_32,BMC-EE-DD-06/2020-21,Construction of Internal Drain and Cover Slab At Puspa Clinic to Bhagaban Pur.(Opposite Side of Bhabagrahi Mohapatra House) Road in Ward No 65,Construction of Internal Drain and Cover Slab At Puspa Clinic to Bhagaban Pur.(Opposite Side of Bhabagrahi Mohapatra House) Road in Ward No 65,Works,Open Tender,Percentage,Civil Works - Others,No,No,NA ,15-Mar-2021 10:00 AM,NA ,120.0,No ,No,Online,31-Mar-2021 11:00 AM,Municipal Bodies||Bhubaneswar Municipal Corporation,BMC Area Limited,751014.0,1.0,"9,80,358",SUKANTA KUMAR BEHERA,"1,151,802",Rejected-AOC,14-Sep-2021,Municipal Bodies||Bhubaneswar Municipal Corporation,Construction of Internal Drain and Cover Slab At Puspa Clinic to Bhagaban Pur.(Opposite Side of Bhabagrahi Mohapatra House) Road in Ward No 65 | Construction of Internal Drain and Cover Slab At Puspa Clinic to Bhagaban Pur.(Opposite Side of Bhabagrahi Mohapatra House) Road in Ward No 65,construction of internal drain and cover slab at puspa clinic to bhagaban pur.(opposite side of bhabagrahi mohapatra house) road in ward no 65 | construction of internal drain and cover slab at puspa clinic to bhagaban pur.(opposite side of bhabagrahi mohapatra house) road in ward no 65,False,False,False,False,False,True,False,True,0.03715236039529229,False,True
2021_ORULB_70759_1,KCDA/NAC-9/2021-22,"Construction of Vehicle Shade at MCC / MRF, Ward No.8, Kuchinda NAC","Construction of Vehicle Shade at MCC MRF, Ward No.8, Kuchinda NAC",Works,Open Tender,Percentage,Mechanical Works,No,No,NA ,02-Sep-2021 02:00 PM,NA ,90.0,No ,No,Online,09-Sep-2021 11:00 AM,Municipal Bodies||Kuchinda NAC,Ward No-8 NAC KUCHINDA,768222.0,1.0,"8,49,809",BISHAL AGRAWAL,"722,462.91",Rejected-AOC,28-Sep-2021,Municipal Bodies||Kuchinda NAC,"Construction of Vehicle Shade at MCC / MRF, Ward No.8, Kuchinda NAC | Construction of Vehicle Shade at MCC MRF, Ward No.8, Kuchinda NAC","construction of vehicle shade at mcc / mrf, ward no.8, kuchinda nac | construction of vehicle shade at mcc mrf, ward no.8, kuchinda nac",False,False,False,False,False,False,True,True,0.008513896462521216,False,True
2021_OSAMB_69371_2,04/RMC-Mukhiguda/2020-21,Const work under RMC Mukhiguda,"Construction of GCI Cover shed,CDOF,FIC-cum-FRS,Toilet block,Int C.C road, and Sinking of Tube well at Khalia Bhata,Paik-Kendumundi,Sargiguda,Badkarlakot Kandabutra MY -RMC Mukhiguda",Works,Open Tender,Percentage,Civil Works - Others,No,No,NA ,26-Jun-2021 02:00 PM,NA ,90.0,No ,No,Online,14-Jul-2021 10:30 AM,Odisha State Agricultural Marketing Board||RMC Mukhiguda,JAIPATNA AND KOKSARA BLOCK AREA,766018.0,2.0,"3,23,69,067",MANOJ KUMAR MOHANTY,"27,516,944.35",Rejected-Technical,17-Sep-2021,Odisha State Agricultural Marketing Board||RMC Mukhiguda,"Const work under RMC Mukhiguda | Construction of GCI Cover shed,CDOF,FIC-cum-FRS,Toilet block,Int C.C road, and Sinking of Tube well at Khalia Bhata,Paik-Kendumundi,Sargiguda,Badkarlakot Kandabutra MY -RMC Mukhiguda","const work under rmc mukhiguda | construction of gci cover shed,cdof,fic-cum-frs,toilet block,int c.c road, and sinking of tube well at khalia bhata,paik-kendumundi,sargiguda,badkarlakot kandabutra my -rmc mukhiguda",False,True,False,False,False,False,False,True,0.02404582445373311,False,True
2021_OSAMB_69371_4,04/RMC-Mukhiguda/2020-21,Const work under RMC Mukhiguda,"Construction of GCI Cover shed,CDOF,FIC-cum-FRS,Toilet block,Int C.C road, and Sinking of Tube well at Mingur,Bijmara,Haramal,Ichhapur New Market Yard RMC Mukhiguda.",Works,Open Tender,Percentage,Civil Works - Others,No,No,NA ,26-Jun-2021 03:00 PM,NA ,90.0,No ,No,Online,14-Jul-2021 10:30 AM,Odisha State Agricultural Marketing Board||RMC Mukhiguda,KALAMPUR BLOCK,766013.0,2.0,"3,44,32,134",MANOJ KUMAR MOHANTY,"29,270,757.657",Rejected-Technical,17-Sep-2021,Odisha State Agricultural Marketing Board||RMC Mukhiguda,"Const work under RMC Mukhiguda | Construction of GCI Cover shed,CDOF,FIC-cum-FRS,Toilet block,Int C.C road, and Sinking of Tube well at Mingur,Bijmara,Haramal,Ichhapur New Market Yard RMC Mukhiguda.","const work under rmc mukhiguda | construction of gci cover shed,cdof,fic-cum-frs,toilet block,int c.c road, and sinking of tube well at mingur,bijmara,haramal,ichhapur new market yard rmc mukhiguda.",False,True,False,False,False,False,False,True,0.022595893452373735,False,True
2021_RWSS_66419_13,BID No 25 of 2020-21,Construction of ESR Laying of rising main distribution system single mouth stand post SVAVNRV chamber including supplying of necessary materials for RPWS to village Brahmani under Saintala Block.,Construction of ESR Laying of rising main distribution system single mouth stand post SVAVNRV chamber including supplying of necessary materials for RPWS to village Brahmani under Saintala Block.,Works,National Competitive Bid,Percentage,Civil Works - Water Works,No,No,NA ,15-Feb-2021 10:00 AM,NA ,120.0,No ,No,Online,01-Mar-2021 11:00 AM,Rural Water Supply and Sanitation||RWSS Circle Bolangir||RWSS Division Bolangir,village Bhahmani under Saintala Block,767032.0,2.0,,RANJIT KUMAR SETH,"10,266,389",Rejected-Technical,24-Sep-2021,Rural Water Supply and Sanitation||RWSS Circle Bolangir||RWSS Division Bolangir,Construction of ESR Laying of rising main distribution system single mouth stand post SVAVNRV chamber including supplying of necessary materials for RPWS to village Brahmani under Saintala Block. | Construction of ESR Laying of rising main distribution system single mouth stand post SVAVNRV chamber including supplying of necessary materials for RPWS to village Brahmani under Saintala Block.,construction of esr laying of rising main distribution system single mouth stand post svavnrv chamber including supplying of necessary materials for rpws to village brahmani under saintala block. | construction of esr laying of rising main distribution system single mouth stand post svavnrv chamber including supplying of necessary materials for rpws to village brahmani under saintala block.,False,True,False,False,False,False,False,True,0.04719726707348864,False,True
2021_RWSS_66840_14,BID No 28 of 2020 - 21,Construction of Pump house ESR UGR Laying of rising main distribution system single mouth stand post SVAVNRV chamber including supplying of necessary materials for RPWS to village Rengali under Khaprakhol Block.,Construction of Pump house ESR UGR Laying of rising main distribution system single mouth stand post SVAVNRV chamber including supplying of necessary materials for RPWS to village Rengali under Khaprakhol Block.,Works,National Competitive Bid,Percentage,Civil Works - Water Works,No,No,NA ,02-Mar-2021 05:00 PM,NA ,180.0,No ,No,Online,12-Mar-2021 11:00 AM,Rural Water Supply and Sanitation||RWSS Circle Bolangir||RWSS Division Bolangir,village Rengali under Khaprakhol Block,767028.0,2.0,,SANJAY KUMAR LATH,"11,897,935",Rejected-AOC,23-Sep-2021,Rural Water Supply and Sanitation||RWSS Circle Bolangir||RWSS Division Bolangir,Construction of Pump house ESR UGR Laying of rising main distribution system single mouth stand post SVAVNRV chamber including supplying of necessary materials for RPWS to village Rengali under Khaprakhol Block. | Construction of Pump house ESR UGR Laying of rising main distribution system single mouth stand post SVAVNRV chamber including supplying of necessary materials for RPWS to village Rengali under Khaprakhol Block.,construction of pump house esr ugr laying of rising main distribution system single mouth stand post svavnrv chamber including supplying of necessary materials for rpws to village rengali under khaprakhol block. | construction of pump house esr ugr laying of rising main distribution system single mouth stand post svavnrv chamber including supplying of necessary materials for rpws to village rengali under khaprakhol block.,False,True,False,False,False,False,False,True,0.04394883522998432,False,True
2021_RWSS_66840_21,BID No 28 of 2020 - 21,Construction of pump house ESRUGR Laying of rising main distribution system single mouth stand post SVAVNRV chamber including supplying of necessary materials for RPWS to village Bagalabandh under Patnagarh Block.,Construction of pump house ESRUGR Laying of rising main distribution system single mouth stand post SVAVNRV chamber including supplying of necessary materials for RPWS to village Bagalabandh under Patnagarh Block.,Works,National Competitive Bid,Percentage,Civil Works - Water Works,No,No,NA ,02-Mar-2021 06:00 PM,NA ,180.0,No ,No,Online,12-Mar-2021 11:00 AM,Rural Water Supply and Sanitation||RWSS Circle Bolangir||RWSS Division Bolangir,village Baglabandh under Patnagarh,767025.0,2.0,,SRI SUBASH CHANDRA SINGHANIA,"13,723,456",Rejected-AOC,24-Sep-2021,Rural Water Supply and Sanitation||RWSS Circle Bolangir||RWSS Division Bolangir,Construction of pump house ESRUGR Laying of rising main distribution system single mouth stand post SVAVNRV chamber including supplying of necessary materials for RPWS to village Bagalabandh under Patnagarh Block. | Construction of pump house ESRUGR Laying of rising main distribution system single mouth stand post SVAVNRV chamber including supplying of necessary materials for RPWS to village Bagalabandh under Patnagarh Block.,construction of pump house esrugr laying of rising main distribution system single mouth stand post svavnrv chamber including supplying of necessary materials for rpws to village bagalabandh under patnagarh block. | construction of pump house esrugr laying of rising main distribution system single mouth stand post svavnrv chamber including supplying of necessary materials for rpws to village bagalabandh under patnagarh block.,False,True,False,False,False,False,False,True,0.04474705669835219,False,True
2021_RWSS_66840_9,BID No 28 of 2020 - 21,Construction of Pump house ESR UGR Laying of rising main distribution system single mouth stand post SVAVNRV chamber including supplying of necessary materials for RPWS to village Baduden under Khaprakhol Block.,Construction of Pump house ESR UGR Laying of rising main distribution system single mouth stand post SVAVNRV chamber including supplying of necessary materials for RPWS to village Baduden under Khaprakhol Block.,Works,National Competitive Bid,Percentage,Civil Works - Water Works,No,No,NA ,02-Mar-2021 03:00 PM,NA ,180.0,No ,No,Online,12-Mar-2021 11:00 AM,Rural Water Supply and Sanitation||RWSS Circle Bolangir||RWSS Division Bolangir,village Baduden under Khaprakhol Block,767028.0,2.0,,MADHUSUDAN BARIHA,"11,144,339",Accepted-AOC,23-Sep-2021,Rural Water Supply and Sanitation||RWSS Circle Bolangir||RWSS Division Bolangir,Construction of Pump house ESR UGR Laying of rising main distribution system single mouth stand post SVAVNRV chamber including supplying of necessary materials for RPWS to village Baduden under Khaprakhol Block. | Construction of Pump house ESR UGR Laying of rising main distribution system single mouth stand post SVAVNRV chamber including supplying of necessary materials for RPWS to village Baduden under Khaprakhol Block.,construction of pump house esr ugr laying of rising main distribution system single mouth stand post svavnrv chamber including supplying of necessary materials for rpws to village baduden under khaprakhol block. | construction of pump house esr ugr laying of rising main distribution system single mouth stand post svavnrv chamber including supplying of necessary materials for rpws to village baduden under khaprakhol block.,False,True,False,False,False,False,False,True,0.044503646721707604,False,True
2021_RWSS_67599_3,BID No 31 of 2020 - 21,Construction of ESR OGR Pump house Laying of rising main distribution system single mouth stand post SVAVNRV chamber including supplying of necessary materials for RPWS to village DHUBALPADA under PATNAGARH Block.,Construction of ESR OGR Pump house Laying of rising main distribution system single mouth stand post SVAVNRV chamber including supplying of necessary materials for RPWS to village DHUBALPADA under PATNAGARH Block.,Works,National Competitive Bid,Percentage,Civil Works - Water Works,No,No,NA ,03-Apr-2021 06:55 PM,NA ,180.0,No ,No,Online,13-Apr-2021 11:00 AM,Rural Water Supply and Sanitation||RWSS Circle Bolangir||RWSS Division Bolangir,village dhubalpada under patnagarh block,767025.0,2.0,,SUMEET CONSTRUCTIONS,"13,705,133",Rejected-AOC,23-Sep-2021,Rural Water Supply and Sanitation||RWSS Circle Bolangir||RWSS Division Bolangir,Construction of ESR OGR Pump house Laying of rising main distribution system single mouth stand post SVAVNRV chamber including supplying of necessary materials for RPWS to village DHUBALPADA under PATNAGARH Block. | Construction of ESR OGR Pump house Laying of rising main distribution system single mouth stand post SVAVNRV chamber including supplying of necessary materials for RPWS to village DHUBALPADA under PATNAGARH Block.,construction of esr ogr pump house laying of rising main distribution system single mouth stand post svavnrv chamber including supplying of necessary materials for rpws to village dhubalpada under patnagarh block. | construction of esr ogr pump house laying of rising main distribution system single mouth stand post svavnrv chamber including supplying of necessary materials for rpws to village dhubalpada under patnagarh block.,False,True,False,False,False,False,False,True,0.044740586365621074,False,True
2021_RWSS_70549_1,05/EE/RWSS/2021-22,CONSTRUCTION AND REMODELING OF LABORATORY BUILDING,"Construction and remodeling of Divisional Laboratory building RWSS Division, Boudh",Works,Open Tender,Percentage,Civil Works - Water Works,No,No,NA ,27-Aug-2021 11:00 AM,NA ,60.0,No ,No,Online,07-Sep-2021 12:00 PM,Rural Water Supply and Sanitation||RWSS Circle Berhampur||RWSS Division Boudh,BOUDH,762014.0,1.0,"13,28,979",Bikash Kumar Behera,"1,265,337",Accepted-AOC,30-Sep-2021,Rural Water Supply and Sanitation||RWSS Circle Berhampur||RWSS Division Boudh,"CONSTRUCTION AND REMODELING OF LABORATORY BUILDING | Construction and remodeling of Divisional Laboratory building RWSS Division, Boudh","construction and remodeling of laboratory building | construction and remodeling of divisional laboratory building rwss division, boudh",False,False,False,False,False,False,False,False,0.1667725037501399,True,True
2021_WATCO_65646_1,WATCO (W)-15(1)/ 2020-21 Dt.19.01.2021,Improvement of water supply to provide safe and clean drinking water conforming to drink from tap quality to Vyasanagar on Engineering Procurement and Construction (EPC) Contract Including Operation and Maintenance for a Period of Three Years.,Improvement of water supply to provide safe and clean drinking water conforming to drink from tap quality to Vyasanagar on Engineering Procurement and Construction (EPC) Contract Including Operation and Maintenance for a Period of Three Years.,Works,National Competitive Bid,Turn-key,Civil Works - Water Works,No,No,NA ,27-Jan-2021 01:45 PM,19-Feb-2021 11:00 AM ,120.0,No ,No,Offline,17-May-2021 11:00 AM,WATCO Bhubaneswar,Vyasanagar,755019.0,2.0,,SARJAN INFRACON PVT. LTD.,"694,179,999",Rejected-Finance,16-Sep-2021,WATCO Bhubaneswar,Improvement of water supply to provide safe and clean drinking water conforming to drink from tap quality to Vyasanagar on Engineering Procurement and Construction (EPC) Contract Including Operation and Maintenance for a Period of Three Years. | Improvement of water supply to provide safe and clean drinking water conforming to drink from tap quality to Vyasanagar on Engineering Procurement and Construction (EPC) Contract Including Operation and Maintenance for a Period of Three Years.,improvement of water supply to provide safe and clean drinking water conforming to drink from tap quality to vyasanagar on engineering procurement and construction (epc) contract including operation and maintenance for a period of three years. | improvement of water supply to provide safe and clean drinking water conforming to drink from tap quality to vyasanagar on engineering procurement and construction (epc) contract including operation and maintenance for a period of three years.,False,True,False,False,False,False,False,True,0.19635689233019504,True,True
2021_WATCO_65648_1,WATCO (W)-15(2)/ 2020-21 Dt.19.01.2021,Improvement of water supply to provide safe and clean drinking water conforming to drink from tap quality to Keonjhar on Engineering Procurement and Construction (EPC) Contract Including Operation and Maintenance for a Period of Three Years,Improvement of water supply to provide safe and clean drinking water conforming to drink from tap quality to Keonjhar on Engineering Procurement and Construction (EPC) Contract Including Operation and Maintenance for a Period of Three Years,Works,National Competitive Bid,Turn-key,Civil Works - Water Works,No,No,NA ,27-Jan-2021 01:15 PM,19-Feb-2021 11:00 AM ,120.0,No ,No,Offline,17-May-2021 11:00 AM,WATCO Bhubaneswar,Keonjhar,758001.0,2.0,,M/s Shri Mohangarh Construction Company,"824,623,529",Rejected-Technical,14-Sep-2021,WATCO Bhubaneswar,Improvement of water supply to provide safe and clean drinking water conforming to drink from tap quality to Keonjhar on Engineering Procurement and Construction (EPC) Contract Including Operation and Maintenance for a Period of Three Years | Improvement of water supply to provide safe and clean drinking water conforming to drink from tap quality to Keonjhar on Engineering Procurement and Construction (EPC) Contract Including Operation and Maintenance for a Period of Three Years,improvement of water supply to provide safe and clean drinking water conforming to drink from tap quality to keonjhar on engineering procurement and construction (epc) contract including operation and maintenance for a period of three years | improvement of water supply to provide safe and clean drinking water conforming to drink from tap quality to keonjhar on engineering procurement and construction (epc) contract including operation and maintenance for a period of three years,False,True,False,False,False,False,False,True,0.19500590048362001,True,True
2021_WATCO_65673_1,WATCO (W)-15(3)/ 2020-21 Dt.19.01.2021,Improvement of water supply to provide safe and clean drinking water conforming to drink from tap quality to Anandapur on Engineering Procurement and Construction (EPC) Contract Including Operation and Maintenance for a Period of Three Years,Improvement of water supply to provide safe and clean drinking water conforming to drink from tap quality to Anandapur on Engineering Procurement and Construction (EPC) Contract Including Operation and Maintenance for a Period of Three Years,Works,National Competitive Bid,Turn-key,Civil Works - Water Works,No,No,NA ,27-Jan-2021 11:00 AM,19-Feb-2021 11:00 AM ,120.0,No ,No,Offline,17-May-2021 11:00 AM,WATCO Bhubaneswar,Anandapur,758021.0,2.0,,EAST INDIA UDYOG LIMITED,"727,960,277.51",Rejected-Finance,14-Sep-2021,WATCO Bhubaneswar,Improvement of water supply to provide safe and clean drinking water conforming to drink from tap quality to Anandapur on Engineering Procurement and Construction (EPC) Contract Including Operation and Maintenance for a Period of Three Years | Improvement of water supply to provide safe and clean drinking water conforming to drink from tap quality to Anandapur on Engineering Procurement and Construction (EPC) Contract Including Operation and Maintenance for a Period of Three Years,improvement of water supply to provide safe and clean drinking water conforming to drink from tap quality to anandapur on engineering procurement and construction (epc) contract including operation and maintenance for a period of three years | improvement of water supply to provide safe and clean drinking water conforming to drink from tap quality to anandapur on engineering procurement and construction (epc) contract including operation and maintenance for a period of three years,False,True,False,False,False,False,False,True,0.19681391930847827,True,True
